Title,Rating,Info,None
Roblox,4.4,The perfect platform to create virtual worlds,
Mobile Legends Bang Bang,4.4,An RTS free multiplayer game for Android,
Minecraft Pocket Edition,4.4,A game of creativity and survival in your pocket,
Among Us,4.3,A fun and popular online party game,
Steam,3.9,Free and massive online game store,
Fortnite,4.5,A free mobile battle royale game,
Garry's Mod,4.2,A classic online sandbox game!,
Stumble Guys,4.6,Online battle royale party game,
FIFA Soccer,4.4,Play soccer online for free,
Counter-Strike: Global Offensive,3.7,A free and popular shooter game,
Grand Criminal Online: Heists,4.3,A multiplayer role-playing game,
Counter-Strike,3.8,The classic community online shooter,
Udemy,3.9,Online learning platform for professionals,
Gloud Games,4.4,Cloud gaming service for mobile,
League of Legends,3.9,Free multiplayer online battle arena,
Excel Online,3.7,Create amazing spreadsheets online for free,
Ludo Ninja,3.9,An online board game,
Ludo Games: Win Cash Online,4.3,A free classic ludo with a twist,
Rummy Palace- Play Rummy Online  Indian Card Game,2,Free-to-play Indian rummy game app,
SimCity,3.5,A classic simulation game for Windows PCs,
CrossFire,4,Classic FPS styled game,
Pokémon World Online,3.5,Enter a Pokémon MMORPG,
Hashiriya Drifter Online Drift Racing Multiplayer,4.7,Competitive street drifting game,
Rec Room,4.6,Multiplayer online game,
Teen Patti Refresh - 3 Patti,4,Free online card game app,
Combat Master Mobile,4.9,Free online FPS,
Teen Patti Star-Online 3 Patti,4.7,Free mobile Teen Patti game,
Teen Patti Real-3 Patti Online,4.6,Play Teen Patti with friends,
Ludo Club,4.2,Hit board game Ludo's online game version,
CarX Drift Racing Online,4,Ultimate online high-speed drift racing game,
Real Piano Online,4.1,A free app for Browser games, by MTMEDIA SL.,
No Players Online,4.6,A free first-person horror shooting game,
FIFA Online 4 M by EA SPORTS,4.4,Exciting high-tension free football game,
Rust,3.5,A power-packed action game!,
Drive Zone Online: car race,5,Free-to-play online driving experience,
Trackmania Nations Forever,4.1,Awesome free online racing game,
Team Fortress 2,4,Multiplayer first-person shooter,
GameRanger,3.6,Play various multiplayer games online with ease,
ARMA 3 : Mobile Online,4.2,Free-to-play military action experience,
Day of Dragons,4.1,Play as a dragon in this online game,
Car Racing 3D High on Fuel,4.4,Race on one of 60 unique tracks against online opponents,
Super Smash Flash 2,4.4,Free online flash game,
Age Of Empires Online,3.6,Free online version of the strategy classic,
TeenPatti Winner,4.5,A free online card game,
Yomi Hustle,3.3,Free online turn-based fighting game,
Golf It!,3,Single and multiplayer VR online miniature golf game,
Brawlhalla,4.3,Dominate the heavenly platforms in this free fighting game,
Aviator - online game,4.3,문장을 유지하면서 HTML 태그를 사용하여 한국어 번역을 제공해주세요: Social and simulation in oneSocial and simulation in one -> 하나로 통합된 소셜 및 시뮬레이션,
Garena+,4,Free gaming platform and community,
Vice Online,4.1,Futuristic RPG with open world,
Real Chess Online,4,Alienforce - Real Chess Online,
Gartic Phone,4.3,Online game that combines Pictionary and Telephone,
DashRummy: Online Rummy Game,4.7,Free Indian rummy game app,
WildCraft: Animal Sim Online 3D,4.4,Defend an Animal Family in WildCraft: Animal Sim Online 3D,
Blockman GO  Blocky Mods,4.4,Play online minigames for free,
Need For Speed World,3.8,Car chases and multiplayer online races,
Pokémon TCG Online,4.4,Take Pokémon Cards a Step Further with Pokémon TCG Online,
Games for Windows Marketplace Client,2.8,Buy and download games online,
MODERN WARSHIPS,4.8,Online battleship game for mobile,
RaceRoom Racing Experience,4,A Free and Realistic Online Racing Simulator,
The Hunter,3.7,Free Online Game for Hunting Fans,
NARUTO X BORUTO Ultimate Ninja STORM CONNECTIONS,5,Anime-themed online multiplayer role-playing game,
VRChat Droid,5,Online virtual world for mobile,
Business Tour - Online Multiplayer Board Game,4,Thrilling free online multiplayer tabletop game,
Modern Ops - Online FPS Gun Games Shooter,4.7,Modern Ops - An Exciting Android Shooting Game,
Latency Optimizer,3.8,Avoid latency problems in online games and applications,
Hacker Online RPG,5,A free app for Android, by GEKKO.,
Digimon Card Game,4,Free online competitive trading card game,
Nintendo Switch Online,4.1,Get the most of your Nintendo Switch Multiplayer games with Nintendo Switch Online,
S4 League,4,Free multiplayer online action game,
Parchisi STAR Online,4.4,A free online version of classic Parcheesi,
GameLoad,2.8,Play unity3d and swf games offiline or online on your PC.,
Battlefield: Bad Company 2,4,Online team-based FPS battle simulator,
Wordle,4.7,Play Wordle without the internet,
World of Tanks,3.7,A free tank warfare game for Windows,
T-Rex Chrome Offline Game — Dino Runner Online,4.6,Your new favorite friendly dinosaur,
Car Driving Online,5,Open-world car racing game,
Virtual Towers Online,4.5,Visit the theme park for free in this virtual world,
Candy Crush Saga Online,4.4,A sweet challange to keep you busy for hours,
FIFA World,3.7,Free online football games with FIFA World,
1v1.LOL - Online Building  Shooting Simulator,4.8,Build the ultimate fortress,
EA SPORTS FIFA 16 Companion,4.1,Manage your FIFA 16 Ultimate Team online, and more!,
Football Challenge 2009,3.7,Free 3D online football simulator,
Critical Strike CS: Counter Terrorist Online FPS,4.2,Critical Strike CS: Counter Terrorist Online FPS for android from VERTIGO GAMES OÜ,
Sword Art Online: Integral Factor,4.4,A free app for Android, by Bandai Namco Entertainment Inc..,
Teen Patti Ishq - Online Poker,4.3,A free Indian poker game,
RummyCircle - Play Indian Rummy Online  Card Game,4.7,Free Indian card game,
WinBoard,3.8,A classic 2D chess game with support for online games,
Rummy Grand - Game Online,5,A full version program for Android, by Rahul pradhap.,
Pokéone,4.5,Free 3D online Pokémon game,
War Robots,4.5,A free PVP online shooter with robots,
Frolic: Play  Win Cash Online,4.2,A free program for Android, by Frolic Live.,
Company of Heroes 2,3.6,A WW2 RTS game with online multiplayer,
Domino Cafe - Online,4.4,A free program for Android, by Higgs Gaming.,
Critical Ops: Online Multiplayer FPS Shooting Game,4.1,A Free game for Android‚ by Critical Force Ltd.,
RAN Online,3.8,A modern school of magic,
Wolf Team,4,Multiplayer online action game starring werewolves,
Pet Rescue Saga Online ,4.7,Match blocks and save animals in Pet Rescue Saga Online,
GameSpy Arcade,3.2,Find game servers and your friends online,
Ghost Watchers,4.3,Cooperative online role-playing horror game,
